name,description
Video Surveillance,"which focus on continuous visual monitoring and security management through networked camera systems, recording devices, and control software, supporting real-time observation, event recording, remote access, and situational awareness for homes, businesses, and public environments."
Accessories,"which provide essential supplementary components that support and extend camera operation, including power solutions, storage media, control interfaces, mounting aids, and connectivity tools, ensuring reliability, convenience, and flexibility across diverse photography and shooting conditions."
Binoculars & Scopes,"which enable long-distance visual observation through precision optical magnification, offering clear and detailed viewing for wildlife tracking, outdoor exploration, astronomical observation, and field analysis where distant subjects must be seen accurately."
Video,"which concentrate on motion content creation using dedicated recording and stabilization equipment, supporting high-resolution capture, smooth camera movement, aerial perspectives, and post-production workflows for filmmaking, vlogging, and professional video production."
Lighting & Studio,"which address controlled illumination and scene setup through dedicated lighting instruments and studio infrastructure, allowing precise management of brightness, color, shadows, and backgrounds for portrait photography, product shoots, and creative visual compositions."
Bags & Cases,"which specialize in physical protection and organized transport of imaging equipment, featuring reinforced structures, compartmentalized layouts, and weather-resistant materials to safeguard cameras, lenses, and accessories during storage and travel."
Tripods & Monopods,"which provide mechanical stabilization and positioning support for cameras, enabling fixed framing, long-exposure shooting, controlled camera angles, and smooth motion capture through adjustable legs, mounts, and height configurations."
Flashes,"which deliver controlled bursts of artificial light synchronized with camera exposure, offering adjustable intensity, direction, and timing to manage contrast, freeze motion, and enhance subject visibility in low-light or challenging environments."
Digital Cameras,"which are still-photo camera devices (DSLR, mirrorless, compact/point-and-shoot) centered on a camera body with an image sensor, shutter, and autofocus system, often sold as “body only” or “kit,” supporting interchangeable lenses (for the camera system) and features like megapixels, ISO/low-light performance, burst shooting, and viewfinders—distinct from standalone lenses, video-only gear, or surveillance cameras."
Film Photography,"which center on analog image creation using photosensitive film materials, emphasizing manual shooting techniques, chemical development processes, and darkroom workflows to produce images with distinctive grain, tonal characteristics, and a traditional photographic aesthetic."
Lenses,"which determine optical perspective and image rendering through specialized glass elements, controlling focal length, aperture behavior, depth of field, and distortion characteristics to shape composition, subject emphasis, and visual style."
Underwater Photography,"which target image capture in submerged environments using sealed equipment and pressure-resistant housings, enabling documentation of marine life, underwater landscapes, and aquatic activities while maintaining optical clarity and equipment safety."

